<?xml version='1.0' encoding='UTF-8'?>
<scenario xmlns="https://dueca.tudelft.nl/testscenario"
  xmlns:xsi="http://www.w3.org/2001/XMLSchema-instance"
  xsi:schemaLocation="https://dueca.tudelft.nl/testscenario https://dueca.tudelft.nl/schemas/testscenario.xsd">
  <project name="DuecaTestCommunication">
    <window>DUECA/DUSIME control panel</window>
    <window>Are you serious?</window>
  </project>
  <repository>https://github.com/dueca/</repository>
  <buildoptions>-DUSE_GTK3=ON</buildoptions>
  <execute>
    <platform>solo</platform>
    <node>websock</node>
  </execute>
  <offset x="1" y="-10" />
  <actions>
    <check window="DUECA/DUSIME control panel" x="476" y="36" r="65" g="255" b="11" timeout="10.0"
      wait="0.5" />
    <check window="DUECA/DUSIME control panel" x="476" y="75" r="104" g="104" b="104" timeout="10.0"
      wait="0.5" />
    <snap name="dtcwebsock000.png" />
    <click window="DUECA/DUSIME control panel" x="476" y="75" button="Button.left" pressed="true"
      wait="0.2" />
    <click window="DUECA/DUSIME control panel" x="476" y="75" button="Button.left" pressed="false"
      wait="0.2" />
    <check window="DUECA/DUSIME control panel" x="476" y="75" r="65" g="255" b="11" timeout="10.0"
      wait="0.5" />
    <check window="DUECA/DUSIME control panel" x="475" y="118" r="104" g="104" b="104"
      timeout="10.0" wait="0.5" />
    <click window="DUECA/DUSIME control panel" x="475" y="118" button="Button.left" pressed="true"
      wait="0.2" />
    <click window="DUECA/DUSIME control panel" x="475" y="118" button="Button.left" pressed="false"
      wait="0.2" />
    <check window="DUECA/DUSIME control panel" x="475" y="118" r="65" g="255" b="11" timeout="10.0"
      wait="0.5" />
    <check window="DUECA/DUSIME control panel" x="476" y="163" r="65" g="255" b="11" timeout="10.0"
      wait="0.5" />
    <check window="DUECA/DUSIME control panel" x="475" y="201" r="104" g="104" b="104"
      timeout="10.0" wait="0.5" />
    <click window="DUECA/DUSIME control panel" x="475" y="201" button="Button.left" pressed="true"
      wait="0.2" />
    <click window="DUECA/DUSIME control panel" x="475" y="201" button="Button.left" pressed="false"
      wait="0.2" />
    <check window="DUECA/DUSIME control panel" x="475" y="202" r="65" g="255" b="11" timeout="10.0"
      wait="0.5" />
    <check window="DUECA/DUSIME control panel" x="423" y="201" r="104" g="104" b="104"
      timeout="10.0" wait="0.5" />
    <click window="DUECA/DUSIME control panel" x="423" y="201" button="Button.left" pressed="true"
      wait="0.2" />
    <click window="DUECA/DUSIME control panel" x="423" y="201" button="Button.left" pressed="false"
      wait="0.2" />
    <check window="DUECA/DUSIME control panel" x="423" y="201" r="104" g="104" b="104"
      timeout="10.0" wait="0.5" />
    <check window="DUECA/DUSIME control panel" x="475" y="203" r="65" g="255" b="11" timeout="10.0"
      wait="0.5" />
    <check window="DUECA/DUSIME control panel" x="475" y="244" r="104" g="104" b="104"
      timeout="10.0" wait="0.5" />
    <click window="DUECA/DUSIME control panel" x="475" y="244" button="Button.left" pressed="true"
      wait="0.2" />
    <click window="DUECA/DUSIME control panel" x="475" y="244" button="Button.left" pressed="false"
      wait="0.2" />
    <snap name="dtcwebsock001.png" />
    <check window="DUECA/DUSIME control panel" x="476" y="244" r="65" g="255" b="11" timeout="10.0"
      wait="10.5" />
    <check window="DUECA/DUSIME control panel" x="476" y="201" r="104" g="104" b="104"
      timeout="10.0" wait="0.5" />
    <click window="DUECA/DUSIME control panel" x="476" y="201" button="Button.left" pressed="true"
      wait="0.2" />
    <click window="DUECA/DUSIME control panel" x="476" y="201" button="Button.left" pressed="false"
      wait="0.2" />
    <check window="DUECA/DUSIME control panel" x="476" y="204" r="65" g="255" b="11" timeout="10.0"
      wait="0.5" />
    <check window="DUECA/DUSIME control panel" x="475" y="161" r="104" g="104" b="104"
      timeout="10.0" wait="0.5" />
    <click window="DUECA/DUSIME control panel" x="475" y="161" button="Button.left" pressed="true"
      wait="0.2" />
    <click window="DUECA/DUSIME control panel" x="475" y="161" button="Button.left" pressed="false"
      wait="0.2" />
    <check window="DUECA/DUSIME control panel" x="475" y="161" r="65" g="255" b="11" timeout="10.0"
      wait="0.5" />
    <check window="DUECA/DUSIME control panel" x="477" y="118" r="65" g="255" b="11" timeout="10.0"
      wait="0.5" />
    <check window="DUECA/DUSIME control panel" x="476" y="75" r="104" g="104" b="104" timeout="10.0"
      wait="0.5" />
    <click window="DUECA/DUSIME control panel" x="476" y="75" button="Button.left" pressed="true"
      wait="0.2" />
    <click window="DUECA/DUSIME control panel" x="476" y="75" button="Button.left" pressed="false"
      wait="0.2" />
    <check window="DUECA/DUSIME control panel" x="476" y="75" r="65" g="255" b="11" timeout="10.0"
      wait="0.5" />
    <check window="DUECA/DUSIME control panel" x="476" y="33" r="104" g="104" b="104" timeout="10.0"
      wait="0.5" />
    <click window="DUECA/DUSIME control panel" x="476" y="33" button="Button.left" pressed="true"
      wait="0.2" />
    <click window="DUECA/DUSIME control panel" x="476" y="33" button="Button.left" pressed="false"
      wait="0.2" />
    <check window="DUECA/DUSIME control panel" x="476" y="33" r="65" g="255" b="11" timeout="10.0"
      wait="0.5" />
    <check window="DUECA/DUSIME control panel" x="35" y="-18" r="246" g="245" b="244" timeout="10.0"
      wait="0.5" />
    <click window="DUECA/DUSIME control panel" x="31" y="-18" button="Button.left" pressed="true"
      wait="0.2" />
    <click window="DUECA/DUSIME control panel" x="31" y="-18" button="Button.left" pressed="false"
      wait="0.2" />
    <check window="DUECA/DUSIME control panel" x="60" y="35" r="53" g="132" b="228" timeout="10.0"
      wait="0.5" />
    <click window="DUECA/DUSIME control panel" x="60" y="35" button="Button.left" pressed="true"
      wait="0.2" />
    <click window="DUECA/DUSIME control panel" x="60" y="35" button="Button.left" pressed="false"
      wait="0.2" />
    <check window="Are you serious?" x="12" y="26" r="248" g="248" b="247" timeout="10.0" wait="0.5" />
    <click window="Are you serious?" x="12" y="26" button="Button.left" pressed="true" wait="0.2" />
    <click window="DUECA/DUSIME control panel" x="144" y="155" button="Button.left" pressed="false"
      wait="0.2" />
  </actions>
</scenario>